{
  "version": 1,
  "quality": "preview",
  "inputs": {
    "src": {
      "assetId": "fixture_sample_10s",
      "variant": "source"
    }
  },
  "files": {
    "captions.ass": "[Script Info]\n; Generated by @editor/core — do not edit by hand\nScriptType: v4.00+\nPlayResX: 1080\nPlayResY: 1920\nWrapStyle: 2\nScaledBorderAndShadow: yes\nYCbCr Matrix: TV.709\n\n[V4+ Styles]\nFormat: Name, Fontname, Fontsize, PrimaryColour, SecondaryColour, OutlineColour, BackColour, Bold, Italic, Underline, StrikeOut, ScaleX, ScaleY, Spacing, Angle, BorderStyle, Outline, Shadow, Alignment, MarginL, MarginR, MarginV, Encoding\nStyle: Caption,Montserrat ExtraBold,84,&H00FFFFFF&,&H0000D4FF&,&H00000000&,&H33000000&,0,0,0,0,100,100,0,0,1,6,3,2,60,60,422,1\nStyle: Hook,Montserrat ExtraBold,75.6,&H00000000&,&H0000D4FF&,&H00FFFFFF&,&H00FFFFFF&,0,0,0,0,100,100,0,0,3,18,0,8,60,60,230,1\n\n[Events]\nFormat: Layer, Start, End, Style, Name, MarginL, MarginR, MarginV, Effect, Text\nDialogue: 0,0:00:00.00,0:00:00.50,Caption,,0,0,0,,{\\1c&H0000D4FF&\\alpha&H00&\\fscx100\\fscy100}HOLA {\\1c&H00FFFFFF&\\alpha&H00&\\fscx100\\fscy100}A {\\1c&H00FFFFFF&\\alpha&H00&\\fscx100\\fscy100}TODOS\nDialogue: 0,0:00:00.50,0:00:01.00,Caption,,0,0,0,,{\\1c&H00FFFFFF&\\alpha&H00&\\fscx100\\fscy100}HOLA {\\1c&H0000D4FF&\\alpha&H00&\\fscx100\\fscy100}A {\\1c&H00FFFFFF&\\alpha&H00&\\fscx100\\fscy100}TODOS\nDialogue: 0,0:00:01.00,0:00:01.50,Caption,,0,0,0,,{\\1c&H00FFFFFF&\\alpha&H00&\\fscx100\\fscy100}HOLA {\\1c&H00FFFFFF&\\alpha&H00&\\fscx100\\fscy100}A {\\1c&H0000D4FF&\\alpha&H00&\\fscx100\\fscy100}TODOS\nDialogue: 0,0:00:01.50,0:00:02.00,Caption,,0,0,0,,{\\1c&H0000D4FF&\\alpha&H00&\\fscx100\\fscy100}HOY\nDialogue: 0,0:00:02.00,0:00:02.50,Caption,,0,0,0,,{\\1c&H0000D4FF&\\alpha&H00&\\fscx100\\fscy100}UNA {\\1c&H00FFFFFF&\\alpha&H00&\\fscx100\\fscy100}M***** {\\1c&H00FFFFFF&\\alpha&H00&\\fscx100\\fscy100}QUE\nDialogue: 0,0:00:02.50,0:00:03.00,Caption,,0,0,0,,{\\1c&H00FFFFFF&\\alpha&H00&\\fscx100\\fscy100}UNA {\\1c&H0000D4FF&\\alpha&H00&\\fscx100\\fscy100}M***** {\\1c&H00FFFFFF&\\alpha&H00&\\fscx100\\fscy100}QUE\nDialogue: 0,0:00:03.00,0:00:03.50,Caption,,0,0,0,,{\\1c&H00FFFFFF&\\alpha&H00&\\fscx100\\fscy100}UNA {\\1c&H00FFFFFF&\\alpha&H00&\\fscx100\\fscy100}M***** {\\1c&H0000D4FF&\\alpha&H00&\\fscx100\\fscy100}QUE\nDialogue: 0,0:00:03.50,0:00:04.00,Caption,,0,0,0,,{\\1c&H0000D4FF&\\alpha&H00&\\fscx100\\fscy100}ME {\\1c&H00FFFFFF&\\alpha&H00&\\fscx100\\fscy100}PASÓ\nDialogue: 0,0:00:04.00,0:00:04.50,Caption,,0,0,0,,{\\1c&H00FFFFFF&\\alpha&H00&\\fscx100\\fscy100}ME {\\1c&H0000D4FF&\\alpha&H00&\\fscx100\\fscy100}PASÓ\nDialogue: 1,0:00:00.00,0:00:01.50,Hook,,0,0,0,,{\\an8\\fad(120,120)}Lo que pasó ayer…\n"
  },
  "fonts": [
    "Montserrat-Bold.ttf",
    "Montserrat-ExtraBold.ttf",
    "Montserrat-Black.ttf",
    "BebasNeue-Regular.ttf"
  ],
  "args": [
    "-hide_banner",
    "-nostdin",
    "-y",
    "-ss",
    "0.500",
    "-t",
    "2.000",
    "-i",
    "{{input:src}}",
    "-ss",
    "3.500",
    "-t",
    "2.500",
    "-i",
    "{{input:src}}",
    "-filter_complex",
    "[0:v]setpts=PTS-STARTPTS[v0s];\n[v0s]split[v0b0m][v0b0c];\n[v0b0c]crop=w='trunc(0.2*iw/2)*2':h='trunc(0.3*ih/2)*2':x='clip((if(lt((t+0.500),0.500),0.5,if(lt((t+0.500),2.500),(0.5+(0.01818)*(((t+0.500)-0.500)/(2.500-0.500))),0.51818)))*iw-out_w/2,0,iw-out_w)':y='clip((if(lt((t+0.500),0.500),0.35,if(lt((t+0.500),2.500),(0.35+(0.01818)*(((t+0.500)-0.500)/(2.500-0.500))),0.36818)))*ih-out_h/2,0,ih-out_h)',gblur=sigma=8:steps=2[v0b0e];\n[v0b0m][v0b0e]overlay=x='clip((if(lt((t+0.500),0.500),0.5,if(lt((t+0.500),2.500),(0.5+(0.01818)*(((t+0.500)-0.500)/(2.500-0.500))),0.51818)))*W-w/2,0,W-w)':y='clip((if(lt((t+0.500),0.500),0.35,if(lt((t+0.500),2.500),(0.35+(0.01818)*(((t+0.500)-0.500)/(2.500-0.500))),0.36818)))*H-h/2,0,H-h)':enable='between(t,0.000,2.000)':eval=frame[v0b0];\n[v0b0]crop=w='trunc(min(iw,ih/1*0.5625)/2)*2':h='trunc(min(iw,ih/1*0.5625)/0.5625/2)*2':x='clip((0.5)*iw-out_w/2,0,iw-out_w)':y='clip((0.5)*ih-out_h/2,0,ih-out_h)'[v0r];\n[v0r]scale=540:960:flags=lanczos,setsar=1,fps=30,format=yuv420p[v0];\n[0:a]asetpts=PTS-STARTPTS,aresample=48000,aformat=sample_fmts=fltp:channel_layouts=stereo[a0];\n[1:v]setpts=PTS-STARTPTS[v1s];\n[v1s]split[v1b0m][v1b0c];\n[v1b0c]crop=w='trunc(0.2*iw/2)*2':h='trunc(0.3*ih/2)*2':x='clip((if(lt((t+3.500),3.500),0.52727,if(lt((t+3.500),6.000),(0.52727+(0.02273)*(((t+3.500)-3.500)/(6.000-3.500))),0.55)))*iw-out_w/2,0,iw-out_w)':y='clip((if(lt((t+3.500),3.500),0.37727,if(lt((t+3.500),6.000),(0.37727+(0.02273)*(((t+3.500)-3.500)/(6.000-3.500))),0.4)))*ih-out_h/2,0,ih-out_h)',gblur=sigma=8:steps=2[v1b0e];\n[v1b0m][v1b0e]overlay=x='clip((if(lt((t+3.500),3.500),0.52727,if(lt((t+3.500),6.000),(0.52727+(0.02273)*(((t+3.500)-3.500)/(6.000-3.500))),0.55)))*W-w/2,0,W-w)':y='clip((if(lt((t+3.500),3.500),0.37727,if(lt((t+3.500),6.000),(0.37727+(0.02273)*(((t+3.500)-3.500)/(6.000-3.500))),0.4)))*H-h/2,0,H-h)':enable='between(t,0.000,2.500)':eval=frame[v1b0];\n[v1b0]crop=w='trunc(min(iw,ih/1*0.5625)/2)*2':h='trunc(min(iw,ih/1*0.5625)/0.5625/2)*2':x='clip((0.5)*iw-out_w/2,0,iw-out_w)':y='clip((0.5)*ih-out_h/2,0,ih-out_h)'[v1r];\n[v1r]scale=540:960:flags=lanczos,setsar=1,fps=30,format=yuv420p[v1];\n[1:a]asetpts=PTS-STARTPTS,aresample=48000,aformat=sample_fmts=fltp:channel_layouts=stereo,volume=0:enable='between(t,0.460,0.940)'[a1];\n[v0][a0][v1][a1]concat=n=2:v=1:a=1[vc][ac];\n[vc]zoompan=z='1+between(it,1.000,2.000)*0.15*min(1,(it-1.000)/0.08)':x='iw/2-(iw/zoom/2)':y='ih/2-(ih/zoom/2)':d=1:s=540x960:fps=30[vz];\n[vz]ass=filename='{{file:captions.ass}}':fontsdir='{{fontsdir}}'[vout];\nsine=frequency=1000:sample_rate=48000:duration=0.480,volume=-8dB,aformat=sample_fmts=fltp:channel_layouts=stereo,adelay=2460:all=1[bl0];\n[ac][bl0]amix=inputs=2:normalize=0:duration=first[am];\n[am]volume=0dB,alimiter=limit=0.95[aout]",
    "-map",
    "[vout]",
    "-map",
    "[aout]",
    "-c:v",
    "libx264",
    "-preset",
    "veryfast",
    "-crf",
    "30",
    "-pix_fmt",
    "yuv420p",
    "-r",
    "30",
    "-c:a",
    "aac",
    "-b:a",
    "96k",
    "-ar",
    "48000",
    "-movflags",
    "+faststart",
    "-t",
    "4.500",
    "{{output}}"
  ],
  "output": {
    "container": "mp4",
    "width": 540,
    "height": 960,
    "fps": 30,
    "durationMs": 4500
  },
  "hash": "8fe19e37cf4a0ef323ffbd35df67597e91d268663d0089ebc7b5535a533dcda6"
}
